{
  "schemaVersion": 1,
  "id": "shell.inspector",
  "slice": "S4",
  "scene": "shell.default",
  "anchorKind": "shell.inspector",
  "reference": { "selector": "aside.inspector", "count": 1, "visibleCount": 1 },
  "app": { "selector": "aside[data-parity=\"shell.inspector\"]", "count": 1, "visibleCount": 1 },
  "matchBy": { "kind": "attribute", "reference": "data-parity", "app": "data-parity" },
  "viewports": ["desktop-wide"],
  "themes": ["dark"],
  "stateVectors": ["default"],
  "styleProfile": "shell.inspector",
  "mask": null,
  "disposition": "port"
}
